Symbol,Name,Last Sale,Net Change,% Change,Market Cap,Country,IPO Year,Volume,Sector,Industry
CEV,Eaton Vance California Municipal Income Trust Shares of Beneficial Interest,$10.4346,-0.0354,-0.338%,73392542.00,United States,1999,1680,Finance,Investment Managers
CF,CF Industries Holdings Inc. Common Stock,$81.09,-1.61,-1.947%,15492771666.00,United States,2005,712471,Industrials,Agricultural Chemicals
CFBK,CF Bankshares Inc. Common Stock,$20.00,-0.315,-1.551%,131101260.00,United States,,686,Finance,Major Banks
CFFI,C&F Financial Corporation Common Stock,$67.191,0.251,0.375%,226330397.00,United States,,3355,Finance,Major Banks
CFG,Citizens Financial Group Inc. Common Stock,$32.35,0.21,0.653%,15082312982.00,United States,2014,1737861,Finance,Major Banks
CG,The Carlyle Group Inc. Common Stock,$39.17,0.10,0.256%,14132365532.00,United States,2012,453329,Finance,Investment Managers
CGEN,Compugen Ltd. Ordinary Shares,$1.91,-0.06,-3.046%,165444200.00,Israel,2000,427439,Health Care,Biotechnology: Biological Products (No Diagnostic Substances)
CGTX,Cognition Therapeutics Inc. Common Stock,$2.0816,0.1816,9.558%,63316198.00,United States,2021,527008,Health Care,Biotechnology: Pharmaceutical Preparations
CHD,Church & Dwight Company Inc. Common Stock,$94.69,0.74,0.788%,23329886203.00,United States,,319543,Consumer Discretionary,Package Goods/Cosmetics
CHK,Chesapeake Energy Corporation Common Stock,$77.45,-0.49,-0.629%,10151543981.00,United States,,403344,Energy,Oil & Gas Production
CHKP,Check Point Software Technologies Ltd. Ordinary Shares,$152.585,-0.235,-0.154%,18426164600.00,Israel,1996,189655,Technology,Computer Software: Prepackaged Software
CHMG,Chemung Financial Corp Common Stock,$49.45,0.18,0.365%,233534350.00,United States,,2916,Finance,Major Banks
CHMI,Cherry Hill Mortgage Investment Corporation Common Stock,$3.96,-0.02,-0.503%,106833185.00,,2013,114377,Real Estate,Real Estate Investment Trusts
CHRW,C.H. Robinson Worldwide Inc. Common Stock,$87.41,0.07,0.08%,10196467144.00,United States,1997,303153,Consumer Discretionary,Oil Refining/Marketing
CHT,Chunghwa Telecom Co. Ltd.,$38.07,-0.11,-0.288%,29532599016.00,Taiwan,,34084,Telecommunications,Telecommunications Equipment
CHTR,Charter Communications Inc. Class A Common Stock New,$373.935,-12.735,-3.294%,55312572145.00,United States,,499925,Telecommunications,Cable & Other Pay Television Services
CI,The Cigna Group Common Stock,$306.95,3.29,1.083%,89819698564.00,United States,,509985,Health Care,Medical Specialities
CIA,Citizens Inc. Class A Common Stock ($1.00 Par),$2.86,0.06,2.143%,141720290.00,United States,1994,13443,Finance,Life Insurance
CINF,Cincinnati Financial Corporation Common Stock,$106.80,1.56,1.482%,16757744496.00,United States,,125289,Finance,Property-Casualty Insurers
CINT,CI&T Inc Class A Common Shares,$5.05,-0.03,-0.591%,100848500.00,,2021,49182,Technology,EDP Services
CIO,City Office REIT Inc. Common Stock,$6.07,0.13,2.189%,242426398.00,Canada,2014,162011,Real Estate,Real Estate Investment Trusts
CIVB,Civista Bancshares Inc. Common Stock,$18.06,0.20,1.12%,283469706.00,United States,,7921,Finance,Major Banks
CJET,Chijet Motor Company Inc. Ordinary Shares,$0.682,-0.0105,-1.516%,109365268.00,Cayman Islands,,10140,Consumer Discretionary,Auto Manufacturing
CKPT,Checkpoint Therapeutics Inc. Common Stock,$2.50,0.26,11.607%,58815088.00,United States,,607028,Health Care,Biotechnology: Pharmaceutical Preparations
CL,Colgate-Palmolive Company Common Stock,$80.50,0.61,0.764%,66281466850.00,United States,,1219728,Consumer Discretionary,Package Goods/Cosmetics
CLAR,Clarus Corporation Common Stock,$6.34,0.22,3.595%,241867253.00,United States,,292723,Consumer Discretionary,Recreational Games/Products/Toys
CLBTW,Cellebrite DI Ltd. Warrants,$1.38,-0.19,-12.102%,268672114.00,Israel,,83347,Technology,Computer Software: Prepackaged Software
CLGN,CollPlant Biotechnologies Ltd Ordinary Shares,$6.0754,0.0754,1.257%,67983726.00,Israel,,16170,Health Care,Industrial Specialties
CLLS,Cellectis S.A. American Depositary Shares,$3.06,0.12,4.082%,139768462.00,France,2015,21538,Health Care,Biotechnology: Pharmaceutical Preparations
CLMB,Climb Global Solutions Inc. Common Stock,$50.95,0.45,0.891%,233332047.00,United States,,2842,Technology,Retail: Computer Software & Peripheral Equipment
CLPR,Clipper Realty Inc. Common Stock,$5.22,-0.09,-1.695%,83850050.00,United States,2017,37229,Real Estate,Real Estate Investment Trusts
CLPT,ClearPoint Neuro Inc. Common Stock,$6.02,-0.16,-2.589%,148215813.00,United States,,52515,Health Care,Medical/Dental Instruments
CLSD,Clearside Biomedical Inc. Common Stock,$1.495,0.045,3.103%,93301255.00,United States,2016,274510,Health Care,Biotechnology: Pharmaceutical Preparations
CLST,Catalyst Bancorp Inc. Common Stock,$10.9701,0.0701,0.643%,52318107.00,United States,2021,774,,
CLX,Clorox Company (The) Common Stock,$142.25,0.73,0.516%,17647406691.00,United States,,290547,Consumer Discretionary,Specialty Chemicals
CM,Canadian Imperial Bank of Commerce Common Stock,$47.50,0.24,0.508%,44224744328.00,Canada,,415614,,
CMBM,Cambium Networks Corporation Ordinary Shares,$5.80,-0.07,-1.193%,160457737.00,Cayman Islands,2019,43490,Technology,Radio And Television Broadcasting And Communications Equipment
CMCL,Caledonia Mining Corporation Plc Common Shares,$12.25,0.09,0.74%,235077500.00,Canada,,10247,Basic Materials,Precious Metals
CMCM,Cheetah Mobile Inc. American Depositary Shares each representing fifty (50) Class A Ordinary Shares,$2.23,0.04,1.826%,64697677.00,China,2022,263,Technology,Computer Software: Prepackaged Software
CMCSA,Comcast Corporation Class A Common Stock,$42.55,-0.76,-1.755%,171267143320.00,United States,,6844681,Telecommunications,Cable & Other Pay Television Services
CMCT,Creative Media & Community Trust Corporation Common stock,$3.77,-0.22,-5.514%,85906014.00,United States,,2930,Real Estate,Real Estate Investment Trusts
CME,CME Group Inc. Class A Common Stock,$203.33,1.92,0.953%,73197371810.00,United States,2002,966502,Finance,Investment Bankers/Brokers/Service
CMG,Chipotle Mexican Grill Inc. Common Stock,$2228.10,-5.55,-0.248%,61149446946.00,United States,2006,50348,Consumer Discretionary,Restaurants
CMI,Cummins Inc. Common Stock,$236.81,-0.91,-0.383%,33566601007.00,United States,,206803,Industrials,Industrial Machinery/Components
CMLS,Cumulus Media Inc. Class A Common Stock,$5.13,0.06,1.183%,84686912.00,United States,,27367,Consumer Discretionary,Broadcasting
CMPX,Compass Therapeutics Inc. Common Stock,$1.56,0.11,7.586%,198878669.00,United States,,116044,Health Care,Biotechnology: Pharmaceutical Preparations
CMRX,Chimerix Inc. Common Stock,$0.9561,0.0097,1.025%,84988972.00,United States,2013,42370,Health Care,Biotechnology: Pharmaceutical Preparations
CMS,CMS Energy Corporation Common Stock,$59.66,0.37,0.624%,17406614407.00,United States,,586965,Utilities,Power Generation
CMT,Core Molding Technologies Inc Common Stock,$17.06,-0.31,-1.785%,154234410.00,United States,1996,26076,Consumer Discretionary,Electronic Components
CMTL,Comtech Telecommunications Corp. Common Stock,$8.50,-0.11,-1.278%,242071075.00,United States,,109346,Technology,Radio And Television Broadcasting And Communications Equipment
CMU,MFS Municipal Income Trust Common Stock,$3.30,-0.01,-0.302%,93473536.00,United States,1987,20239,Finance,Investment Managers
CNA,CNA Financial Corporation Common Stock,$42.88,0.46,1.084%,11614928112.00,United States,,181933,Finance,Property-Casualty Insurers
CNC,Centene Corporation Common Stock,$77.25,0.51,0.665%,41267027250.00,United States,,984621,Health Care,Medical Specialities
CNF,CNFinance Holdings Limited American Depositary Shares each representing  twenty (20) Ordinary Shares,$2.19,-0.0262,-1.182%,150194935.00,,2018,11084,Finance,Finance: Consumer Services
CNFRZ,Conifer Holdings Inc. 9.75% Senior Unsecured Notes due 2028,$16.60,1.21,7.862%,202899825.00,United States,,100,,
CNHI,CNH Industrial N.V. Common Shares,$11.895,-0.055,-0.46%,15826103326.00,United Kingdom,2013,4466683,Industrials,Construction/Ag Equipment/Trucks
CNI,Canadian National Railway Company Common Stock,$125.90,0.84,0.672%,81545430000.00,Canada,,332564,Industrials,Railroads
CNP,CenterPoint Energy Inc (Holding Co) Common Stock,$29.22,0.09,0.309%,18444352423.00,United States,,1148474,Utilities,Electric Utilities: Central
CNQ,Canadian Natural Resources Limited Common Stock,$66.85,-0.68,-1.007%,72687743100.00,Canada,,873785,Energy,Oil & Gas Production
CNTB,Connect Biopharma Holdings Limited American Depositary Shares,$1.215,-0.015,-1.22%,66875115.00,China,2021,38774,Health Care,Biotechnology: Pharmaceutical Preparations
CNTY,Century Casinos Inc. Common Stock,$4.675,-0.035,-0.743%,141932677.00,United States,,18012,Consumer Discretionary,Hotels/Resorts
CODA,Coda Octopus Group Inc. Common stock,$6.03,0.03,0.50%,67039701.00,United States,,3488,Industrials,Industrial Machinery/Components
COF,Capital One Financial Corporation Common Stock,$129.79,-0.93,-0.711%,49430102408.00,United States,1994,1036485,Finance,Major Banks
COFS,ChoiceOne Financial Services Inc. Common Stock,$28.81,-0.21,-0.724%,217374158.00,United States,,8405,Finance,Major Banks
COIN,Coinbase Global Inc. Class A Common Stock,$158.39,6.15,4.04%,37894102823.00,United States,,9662301,Finance,Finance: Consumer Services
CONN,Conn's Inc. Common Stock,$4.4209,0.2209,5.26%,108533595.00,United States,2003,78066,Consumer Discretionary,Consumer Electronics/Video Chains
COO,The Cooper Companies Inc. Common Stock,$366.9017,3.0217,0.83%,18171166990.00,United States,,43716,Health Care,Ophthalmic Goods
COP,ConocoPhillips Common Stock,$117.52,-2.41,-2.01%,139544181344.00,United States,,2389861,Energy,Integrated oil Companies
COR,Cencora Inc. Common Stock,$210.67,0.34,0.162%,42284068246.00,United States,,313829,Health Care,Other Pharmaceuticals
COST,Costco Wholesale Corporation Common Stock,$646.66,1.97,0.306%,286941417491.00,United States,,841578,Consumer Discretionary,Department/Specialty Retail Stores
COTY,Coty Inc. Class A Common Stock,$11.61,0.06,0.519%,10352300798.00,United States,2013,1413679,Consumer Discretionary,Package Goods/Cosmetics
COYA,Coya Therapeutics Inc. Common Stock,$6.74,-0.15,-2.177%,67605139.00,United States,2022,22049,Health Care,Biotechnology: Pharmaceutical Preparations
CP,Canadian Pacific Kansas City Limited Common Shares,$79.62,0.76,0.964%,74181954000.00,Canada,,1613150,Industrials,Railroads
CPB,Campbell Soup Company Common Stock,$43.764,-0.766,-1.72%,13046041179.00,United States,,887841,Consumer Staples,Packaged Foods
CPHC,Canterbury Park Holding Corporation 'New' Common Stock,$20.27,-0.27,-1.315%,100227893.00,United States,,1050,Consumer Discretionary,Services-Misc. Amusement & Recreation
CPNG,Coupang Inc. Class A Common Stock,$15.565,0.085,0.549%,27826912422.00,United States,2021,2229923,Consumer Discretionary,Durable Goods
CPRT,Copart Inc. (DE) Common Stock,$46.99,0.16,0.342%,45121275460.00,United States,1994,1065838,Consumer Discretionary,Retail-Auto Dealers and Gas Stations
CPS,Cooper-Standard Holdings Inc. Common Stock,$16.95,-0.54,-3.087%,291497269.00,United States,,51896,Consumer Discretionary,Auto Parts:O.E.M.
CPSI,Computer Programs and Systems Inc. Common Stock,$10.15,0.06,0.595%,147670076.00,United States,2002,120131,Technology,EDP Services
CPSS,Consumer Portfolio Services Inc. Common Stock,$8.58,-0.13,-1.493%,181211917.00,United States,1992,2552,Finance,Finance: Consumer Services
CPT,Camden Property Trust Common Stock,$98.02,0.21,0.215%,10465713612.00,United States,1993,305018,Real Estate,Real Estate Investment Trusts
CPZ,Calamos Long/Short Equity & Dynamic Income Trust Common Stock,$14.72,0.10,0.684%,288985896.00,United States,2019,50106,Finance,Trusts Except Educational Religious and Charitable
CQP,Cheniere Energy Partners LP Common Units,$53.3491,0.7691,1.463%,25823051577.00,United States,2007,97821,Utilities,Oil/Gas Transmission
CRBG,Corebridge Financial Inc. Common Stock,$22.53,0.52,2.363%,14216963465.00,United States,2022,1177547,Finance,Life Insurance
CRDF,Cardiff Oncology Inc. Common Stock,$1.56,0.03,1.961%,69696384.00,United States,,174606,Health Care,Biotechnology: Biological Products (No Diagnostic Substances)
CRDL,Cardiol Therapeutics Inc. Class A Common Shares,$0.8858,0.0057,0.648%,57677933.00,Canada,,46016,Health Care,Biotechnology: Biological Products (No Diagnostic Substances)
CRGO,Freightos Limited Ordinary shares,$3.2896,0.0596,1.845%,156058624.00,Israel,,6971,Finance,Blank Checks
CRH,CRH PLC Ordinary Shares,$66.785,0.445,0.671%,47300650225.00,Ireland,,1935243,Industrials,Building Materials
CRIS,Curis Inc. Common Stock,$14.02,-0.45,-3.11%,82480543.00,United States,,22752,Health Care,Biotechnology: Biological Products (No Diagnostic Substances)
CRL,Charles River Laboratories International Inc. Common Stock,$223.27,-0.75,-0.335%,11453037429.00,United States,2000,190231,Health Care,Biotechnology: Commercial Physical & Biological Resarch
CRM,Salesforce Inc. Common Stock,$251.24,-0.60,-0.238%,243200320000.00,United States,2004,1874426,Technology,Computer Software: Prepackaged Software
CRMD,CorMedix Inc. Common Stock,$3.50,-0.07,-1.961%,191842147.00,United States,,145424,Health Care,Biotechnology: Pharmaceutical Preparations
CRNT,Ceragon Networks Ltd. Ordinary Shares,$2.2096,0.1096,5.219%,186401856.00,Israel,,256836,Technology,Radio And Television Broadcasting And Communications Equipment
CRT,Cross Timbers Royalty Trust Common Stock,$17.80,-0.05,-0.28%,106800000.00,United States,1992,7686,Energy,Oil & Gas Production
CRVO,CervoMed Inc. Common Stock,$9.0599,0.4605,5.355%,51410584.00,United States,,3207,Health Care,Biotechnology: Pharmaceutical Preparations
CRVS,Corvus Pharmaceuticals Inc. Common Stock,$2.15,0.28,14.973%,105432951.00,United States,2016,285750,Health Care,Biotechnology: Pharmaceutical Preparations
CRWD,CrowdStrike Holdings Inc. Class A Common Stock,$245.90,1.54,0.63%,59051608287.00,United States,2019,1113535,Technology,Computer Software: Prepackaged Software
CRWS,Crown Crafts Inc Common Stock,$4.90,-0.09,-1.804%,50179523.00,United States,,7650,Consumer Discretionary,Textiles
CSBR,Champions Oncology Inc. Common Stock,$6.11,-0.04,-0.65%,83057916.00,United States,,12088,Health Care,Biotechnology: Biological Products (No Diagnostic Substances)
CSCO,Cisco Systems Inc. Common Stock (DE),$50.255,-0.255,-0.505%,204209970097.00,United States,1990,6219222,Telecommunications,Computer Communications Equipment
CSGP,CoStar Group Inc. Common Stock,$82.03,-0.74,-0.894%,33498047077.00,United States,1998,546630,Finance,Real Estate
CSL,Carlisle Companies Incorporated Common Stock,$301.82,0.25,0.083%,14693624995.00,United States,,53099,Industrials,Specialty Chemicals
CSLR,Complete Solaria Inc. Common Stock,$1.57,0.01,0.641%,67787226.00,United States,,6605,Technology,Semiconductors
CSPI,CSP Inc. Common Stock,$19.59,-0.9522,-4.635%,92613155.00,United States,1982,6319,Technology,EDP Services
CSSEP,Chicken Soup for the Soul Entertainment Inc. 9.75% Series A Cumulative Redeemable Perpetual Preferred Stock,$5.10,0.50,10.87%,164300646.00,United States,,51015,Consumer Discretionary,Movies/Entertainment
CSTE,Caesarstone Ltd. Ordinary Shares,$4.19,0.16,3.97%,144596900.00,Israel,2012,29217,Industrials,Building Materials
CSX,CSX Corporation Common Stock,$34.835,0.175,0.505%,68838524604.00,United States,,2998123,Industrials,Railroads
CTAS,Cintas Corporation Common Stock,$585.85,5.57,0.96%,59671235030.00,United States,1983,77385,Consumer Discretionary,Apparel
CTCX,Carmell Corporation Common Stock,$3.63,-0.06,-1.626%,83786360.00,United States,2021,2622,Health Care,Medical/Dental Instruments
CTGO,Contango ORE Inc. Common Stock,$15.865,-0.475,-2.907%,149133031.00,United States,2021,12653,Basic Materials,Precious Metals
CTMX,CytomX Therapeutics Inc. Common Stock,$1.595,-0.035,-2.147%,106847302.00,United States,2015,305038,Health Care,Biotechnology: Pharmaceutical Preparations
CTRA,Coterra Energy Inc. Common Stock,$25.535,-0.355,-1.371%,19207214804.00,United States,,2449742,Energy,Oil & Gas Production
CTRM,Castor Maritime Inc. Common Shares,$0.5899,0.0074,1.27%,55810439.00,Cyprus,,2330273,Consumer Discretionary,Marine Transportation
CTRN,Citi Trends Inc. Common Stock,$27.10,0.31,1.157%,231551750.00,United States,2005,30194,Consumer Discretionary,Clothing/Shoe/Accessory Stores
CTSH,Cognizant Technology Solutions Corporation Class A Common Stock,$73.67,0.00,0.00%,36939062264.00,United States,1998,756912,Technology,EDP Services
CTV,Innovid Corp. Common Stock,$1.52,-0.02,-1.299%,213657674.00,,2021,88952,Consumer Discretionary,Advertising
CTVA,Corteva Inc. Common Stock ,$47.485,-0.595,-1.238%,33464056565.00,United States,2019,693192,Industrials,Major Chemicals
CTXR,Citius Pharmaceuticals Inc. Common Stock,$0.7708,-0.0122,-1.558%,122531437.00,United States,,227927,Health Care,Biotechnology: Pharmaceutical Preparations
CUBE,CubeSmart Common Shares,$45.82,-0.46,-0.994%,10303129462.00,United States,,411781,Real Estate,Real Estate Investment Trusts
CUE,Cue Biopharma Inc. Common Stock,$2.65,-0.07,-2.574%,119576695.00,United States,2018,41657,Health Care,Biotechnology: Pharmaceutical Preparations
CULL,Cullman Bancorp Inc. Common Stock,$10.785,0.025,0.232%,78263089.00,United States,2021,1408,Finance,Savings Institutions
CULP,Culp Inc. Common Stock,$5.69,-0.01,-0.175%,70953748.00,United States,,6474,Consumer Discretionary,Textiles
CUTR,Cutera Inc. Common Stock,$2.80,-0.14,-4.762%,55842850.00,United States,2004,242631,Health Care,Biotechnology: Electromedical & Electrotherapeutic Apparatus
CVCY,Central Valley Community Bancorp Common Stock,$21.74,0.01,0.046%,256855556.00,United States,,5617,Finance,Major Banks
CVE,Cenovus Energy Inc Common Stock,$16.50,-0.51,-2.998%,31111723500.00,Canada,,4149013,Energy,Oil & Gas Production
CVGI,Commercial Vehicle Group Inc. Common Stock,$6.59,-0.18,-2.659%,222129591.00,United States,2004,37927,Consumer Discretionary,Auto Parts:O.E.M.
CVLY,Codorus Valley Bancorp Inc Common Stock,$25.22,0.35,1.407%,242392194.00,United States,,24080,Finance,Savings Institutions
CVM,Cel-Sci Corporation Common Stock,$2.46,-0.16,-6.107%,122952778.00,United States,1997,526740,Health Care,Biotechnology: Biological Products (No Diagnostic Substances)
CVS,CVS Health Corporation Common Stock,$80.675,-0.205,-0.253%,103820381753.00,United States,,3995190,Consumer Staples,Retail-Drug Stores and Proprietary Stores
CVX,Chevron Corporation Common Stock,$151.59,-0.74,-0.486%,286163820127.00,United States,,3141008,Energy,Integrated oil Companies
CWBC,Community West Bancshares Common Stock,$17.03,-0.15,-0.873%,150720813.00,United States,,4190,Finance,Major Banks
CX,Cemex S.A.B. de C.V. Sponsored ADR,$7.385,-0.035,-0.472%,10864452144.00,Mexico,,1566749,Industrials,Building Materials
CXDO,Crexendo Inc. Common Stock,$4.70,-0.06,-1.261%,122362639.00,United States,,143633,Telecommunications,Telecommunications Equipment
CXE,MFS High Income Municipal Trust Common Stock,$3.59,-0.01,-0.278%,113177525.00,United States,1989,31083,Finance,Investment Managers
CXH,MFS Investment Grade Municipal Trust Common Stock,$7.5647,-0.0153,-0.202%,68916270.00,United States,1989,3235,Finance,Investment Managers
CYBN,Cybin Inc. Common Shares,$0.3921,0.0081,2.109%,100602480.00,Canada,,1231614,Health Care,Biotechnology: Pharmaceutical Preparations
CYT,Cyteir Therapeutics Inc. Common Stock,$3.0699,0.0399,1.317%,110510469.00,United States,2021,3015,Health Care,Biotechnology: Pharmaceutical Preparations
CZFS,Citizens Financial Services Inc. Common Stock,$62.71,0.11,0.176%,295120221.00,United States,,1206,Finance,Major Banks
CZWI,Citizens Community Bancorp Inc. Common Stock,$11.54,0.00,0.00%,120801770.00,United States,2006,5058,Finance,Savings Institutions
D,Dominion Energy Inc. Common Stock,$48.34,-0.09,-0.186%,40450755910.00,United States,,1345406,,
DAL,Delta Air Lines Inc. Common Stock,$39.325,0.585,1.51%,25304199503.00,United States,,4154753,Consumer Discretionary,Air Freight/Delivery Services
DASH,DoorDash Inc. Class A Common Stock,$94.18,0.41,0.437%,37503296308.00,United States,,1084283,Industrials,Industrial Machinery/Components
DAVE,Dave Inc. Class A Common Stock,$8.36,-0.04,-0.476%,101167453.00,United States,,4101,Technology,Retail: Computer Software & Peripheral Equipment
DB,Deutsche Bank AG Common Stock,$13.655,0.315,2.361%,27856200000.00,Germany,,1699944,Finance,Major Banks
DBVT,DBV Technologies S.A. American Depositary Shares,$0.939,0.059,6.705%,180829903.00,France,2014,27780,Health Care,Biotechnology: Pharmaceutical Preparations
DC,Dakota Gold Corp. Common Stock,$2.48,-0.06,-2.362%,215115875.00,United States,2022,61568,Basic Materials,Precious Metals
DCTH,Delcath Systems Inc. Common Stock,$4.16,0.06,1.463%,91711780.00,United States,,58818,Health Care,Medical/Dental Instruments
DD,DuPont de Nemours Inc. Common Stock,$76.83,-0.19,-0.247%,33040164660.00,United States,2017,883186,Industrials,Major Chemicals
DDC,DDC Enterprise Limited Class A Ordinary Shares,$4.30,-0.19,-4.232%,85669192.00,,2023,127124,Basic Materials,Metal Mining
DDOG,Datadog Inc. Class A Common Stock,$113.30,0.88,0.783%,37225131491.00,United States,2019,1716154,Technology,Computer Software: Prepackaged Software
DE,Deere & Company Common Stock,$393.92,0.57,0.145%,110398223713.00,United States,,458470,Industrials,Industrial Machinery/Components
DECK,Deckers Outdoor Corporation Common Stock,$673.42,-4.92,-0.725%,17327685169.00,United States,1993,73103,Consumer Discretionary,Shoe Manufacturing
DELL,Dell Technologies Inc. Class C Common Stock ,$76.52,-0.08,-0.104%,54451717014.00,United States,2018,1189895,Technology,Computer Manufacturing
DEO,Diageo plc Common Stock,$143.1101,0.0501,0.035%,80489692178.00,United Kingdom,,439793,Consumer Staples,Beverages (Production/Distribution)
DERM,Journey Medical Corporation Common Stock,$5.0097,0.0297,0.596%,92721777.00,United States,2021,192737,Health Care,Biotechnology: Pharmaceutical Preparations
DFS,Discover Financial Services Common Stock,$110.545,-0.195,-0.176%,27642656635.00,United States,,393350,Finance,Finance: Consumer Services
DG,Dollar General Corporation Common Stock,$135.91,4.63,3.527%,29831871791.00,United States,2009,1291366,Consumer Discretionary,Department/Specialty Retail Stores
DGHI,Digihost Technology Inc. Common Subordinate Voting Shares,$2.25,0.05,2.273%,64593560.00,Canada,,155665,,
DGX,Quest Diagnostics Incorporated Common Stock,$140.585,0.905,0.648%,15806674053.00,United States,,216858,Health Care,Medical Specialities
DHI,D.R. Horton Inc. Common Stock,$148.973,1.023,0.691%,49635475748.00,United States,,712670,Consumer Discretionary,Homebuilding
DHR,Danaher Corporation Common Stock,$231.9554,1.1454,0.496%,171398132675.00,United States,,1271733,Industrials,Industrial Machinery/Components
DHX,DHI Group Inc. Common Stock,$2.555,-0.005,-0.195%,119619660.00,United States,2007,18383,Consumer Discretionary,Business Services
DIBS,1stdibs.com Inc. Common Stock,$5.04,0.35,7.463%,201505490.00,United States,2021,64877,Consumer Discretionary,Catalog/Specialty Distribution
DIS,Walt Disney Company (The) Common Stock,$90.125,-1.525,-1.664%,164957222380.00,United States,,5957324,Consumer Discretionary,Movies/Entertainment
DIT,AMCON Distributing Company Common Stock,$192.00,3.31,1.754%,121029504.00,United States,1999,591,Consumer Discretionary,Food Distributors
DKNG,DraftKings Inc. Class A Common Stock,$33.2519,1.0419,3.235%,28571890729.00,United States,2019,7210366,Consumer Discretionary,Services-Misc. Amusement & Recreation
DKS,Dick's Sporting Goods Inc Common Stock,$138.83,-0.02,-0.014%,11348555199.00,United States,2002,533867,Consumer Discretionary,Other Specialty Stores
DLA,Delta Apparel Inc. Common Stock,$7.39,0.10,1.372%,51737538.00,United States,2000,10228,Consumer Staples,Apparel
DLB,Dolby Laboratories Common Stock,$84.52,-0.06,-0.071%,10005515634.00,United States,2005,90959,Technology,EDP Services
DLHC,DLH Holdings Corp.,$15.61,-0.01,-0.064%,219597297.00,United States,,12297,Consumer Discretionary,Professional Services
DLNG,Dynagas LNG Partners LP Common Units,$2.93,-0.01,-0.34%,107830584.00,Greece,,12077,Consumer Discretionary,Marine Transportation
DLR,Digital Realty Trust Inc. Common Stock,$132.50,-1.01,-0.756%,40127901925.00,United States,2004,377138,Real Estate,Real Estate Investment Trusts
DLTH,Duluth Holdings Inc. Class B Common Stock,$5.23,-0.08,-1.507%,180305615.00,United States,2015,8883,Consumer Discretionary,Clothing/Shoe/Accessory Stores
DLTR,Dollar Tree Inc. Common Stock,$137.065,0.345,0.252%,29862617045.00,United States,1995,627867,Consumer Discretionary,Department/Specialty Retail Stores
DM,Desktop Metal Inc. Class A Common Stock,$0.6607,-0.0094,-1.403%,214553240.00,United States,2019,1118498,Technology,Industrial Machinery/Components
DMAC,DiaMedica Therapeutics Inc. Common Stock,$2.86,-0.04,-1.379%,108547613.00,United States,2018,8728,Health Care,Biotechnology: Pharmaceutical Preparations
DMTK,DermTech Inc. Common Stock,$1.48,-0.05,-3.268%,50679673.00,United States,2017,179737,Health Care,Medical Specialities
DNMR,Danimer Scientific Inc. Common Stock,$0.9101,-0.0219,-2.35%,92862296.00,United States,2020,1336978,Industrials,Plastic Products
DNTH,Dianthus Therapeutics Inc. Common Stock,$12.955,-0.055,-0.423%,191964107.00,United States,2018,24140,Health Care,Biotechnology: Pharmaceutical Preparations
DOCU,DocuSign Inc. Common Stock,$55.08,0.05,0.091%,11232678882.00,United States,2018,808071,Technology,Computer Software: Prepackaged Software
DOGZ,Dogness (International) Corporation Class A Common Stock,$9.195,0.865,10.384%,97667111.00,China,2017,615417,Consumer Discretionary,Miscellaneous manufacturing industries
DOMA,Doma Holdings Inc. Common Stock,$4.5604,0.0004,0.009%,61276918.00,United States,2021,1274,Finance,Real Estate
