Symbol,Name,Last Sale,Net Change,% Change,Market Cap,Country,IPO Year,Volume,Sector,Industry
QUBT,Quantum Computing Inc. Common Stock,$0.8585,-0.0055,-0.637%,64470988.00,United States,,352453,Technology,Computer Software: Prepackaged Software
QUIK,QuickLogic Corporation Common Stock,$13.82,-0.09,-0.647%,192237955.00,United States,1999,57842,Technology,Semiconductors
RACE,Ferrari N.V. Common Shares,$336.38,3.03,0.909%,65231986930.00,Italy,2015,166983,Consumer Discretionary,Auto Manufacturing
RANI,Rani Therapeutics Holdings Inc. Class A Common Stock,$3.12,-0.05,-1.577%,155989105.00,United States,2021,15707,Health Care, Medicinal Chemicals and Botanical Products 
RBA,RB Global Inc. Common Stock,$66.21,0.58,0.884%,12072252900.00,Canada,,240901,Consumer Discretionary,Business Services
RBKB,Rhinebeck Bancorp Inc. Common Stock,$8.2398,0.0398,0.485%,91236067.00,United States,2019,2088,Finance,Major Banks
RBLX,Roblox Corporation Class A Common Stock,$42.69,0.78,1.861%,26627332445.00,United States,2021,2619248,Technology,EDP Services
RBOT,Vicarious Surgical Inc. Class A Common Stock,$0.4119,0.0101,2.514%,72036964.00,Hong Kong,2020,146682,Health Care,Medical Specialities
RBT,Rubicon Technologies Inc. Class A Common Stock,$1.555,-0.095,-5.758%,53458995.00,,2022,191044,Technology,Computer Software: Prepackaged Software
RCAT,Red Cat Holdings Inc. Common Stock,$0.91,0.02,2.247%,67488016.00,United States,,50666,Industrials,Wholesale Distributors
RCI,Rogers Communication Inc. Common Stock,$46.28,-0.39,-0.836%,24462034480.00,Canada,,121447,Telecommunications,Cable & Other Pay Television Services
RCKY,Rocky Brands Inc. Common Stock,$27.015,-0.395,-1.441%,199312050.00,United States,1993,20812,Consumer Discretionary,Shoe Manufacturing
RCL,Royal Caribbean Cruises Ltd. Common Stock,$120.21,2.76,2.35%,30802021852.00,United States,1993,1010907,Consumer Discretionary,Marine Transportation
RCMT,RCM Technologies Inc. Common Stock,$31.47,1.15,3.793%,246485408.00,United States,,52422,Consumer Discretionary,Professional Services
RDCM,Radcom Ltd. Ordinary Shares,$8.01,-0.02,-0.249%,120069900.00,Israel,1997,10276,Technology,Computer peripheral equipment
RDVT,Red Violet Inc. Common Stock ,$18.535,-0.275,-1.462%,258366872.00,United States,,3900,Technology,Computer Software: Prepackaged Software
RDW,Redwire Corporation Common Stock,$2.99,-0.06,-1.967%,193751525.00,United States,2021,53442,Industrials,Military/Government/Technical
RDY,Dr. Reddy's Laboratories Ltd Common Stock,$70.44,-0.07,-0.099%,11730223585.00,India,,57893,Health Care,Biotechnology: Pharmaceutical Preparations
REAL,The RealReal Inc. Common Stock,$1.9622,0.0622,3.274%,202799484.00,United States,2019,1314137,Consumer Discretionary,Other Specialty Stores
REE,REE Automotive Ltd. Class A Ordinary Shares,$4.725,0.0738,1.587%,52726204.00,Israel,,5033,Consumer Discretionary,Auto Manufacturing
REFI,Chicago Atlantic Real Estate Finance Inc. Common Stock,$15.8306,0.1506,0.96%,287835784.00,United States,2021,66056,Real Estate,Real Estate Investment Trusts
REG,Regency Centers Corporation Common Stock,$65.33,-0.43,-0.654%,12058675489.00,United States,1993,536938,Real Estate,Real Estate Investment Trusts
REGN,Regeneron Pharmaceuticals Inc. Common Stock,$922.34,4.78,0.521%,100486161223.00,United States,1991,119348,Health Care,Biotechnology: Pharmaceutical Preparations
REI,Ring Energy Inc. Common Stock,$1.48,-0.02,-1.333%,289532845.00,United States,,1118240,Energy,Oil & Gas Production
REKR,Rekor Systems Inc. Common Stock,$3.485,0.215,6.575%,240977619.00,United States,,461805,Telecommunications,Telecommunications Equipment
RELL,Richardson Electronics Ltd. Common Stock,$12.72,0.07,0.553%,181596330.00,United States,1983,53679,Technology,Electronic Components
RELX,RELX PLC PLC American Depositary Shares (Each representing One Ordinary Share),$39.235,0.535,1.382%,74113355762.00,United Kingdom,2015,1353479,Consumer Discretionary,Business Services
RENB,Renovaro Biosciences Inc. Common Stock,$3.58,0.22,6.548%,238779356.00,United States,,133485,Health Care,Biotechnology: Pharmaceutical Preparations
REXR,Rexford Industrial Realty Inc. Common Stock,$54.75,-0.42,-0.761%,11557578215.00,United States,2013,261083,Real Estate,Real Estate Investment Trusts
RF,Regions Financial Corporation Common Stock,$19.05,0.25,1.33%,17717737069.00,United States,,2309695,Finance,Major Banks
RFM,RiverNorth Flexible Municipal Income Fund Inc. Common Stock,$15.585,-0.0201,-0.129%,95297584.00,,2020,14149,Finance,Finance/Investors Services
RGA,Reinsurance Group of America Incorporated Common Stock,$164.08,-0.05,-0.03%,10813817921.00,United States,,136036,Finance,Life Insurance
RGC,Regencell Bioscience Holdings Limited Ordinary Shares,$10.50,0.00,0.00%,136635093.00,Hong Kong,2021,49,Health Care, Medicinal Chemicals and Botanical Products 
RGCO,RGC Resources Inc. Common Stock,$19.07,-0.32,-1.65%,191305701.00,United States,,15819,Utilities,Oil & Gas Production
RGF,The Real Good Food Company Inc. Class A Common Stock,$1.50,-0.10,-6.25%,50526306.00,United States,2021,56872,Consumer Staples,Packaged Foods
RGT,Royce Global Value Trust Inc. Common Stock,$9.655,-0.075,-0.771%,60507335.00,,2013,1708,Finance,Trusts Except Educational Religious and Charitable
RIGL,Rigel Pharmaceuticals Inc. Common Stock,$1.4901,0.0401,2.766%,259827996.00,United States,2000,418126,Health Care,Biotechnology: Pharmaceutical Preparations
RIO,Rio Tinto Plc Common Stock,$73.15,-0.40,-0.544%,119019440609.00,Australia,2002,729882,Basic Materials,Metal Mining
RIVN,Rivian Automotive Inc. Class A Common Stock,$19.925,-0.395,-1.944%,19082523021.00,United States,2021,14548069,Consumer Discretionary,Auto Manufacturing
RJF,Raymond James Financial Inc. Common Stock,$110.455,0.995,0.909%,23041659565.00,United States,,240605,Finance,Investment Bankers/Brokers/Service
RKT,Rocket Companies Inc. Class A Common Stock,$12.775,-0.565,-4.235%,25323584549.00,United States,2020,1867685,Finance,Finance: Consumer Services
RLMD,Relmada Therapeutics Inc. Common Stock,$3.22,-1.31,-28.918%,96919434.00,United States,,1949210,Health Care,Biotechnology: Pharmaceutical Preparations
RLYB,Rallybio Corporation Common Stock,$2.135,-0.115,-5.111%,80689560.00,United States,2021,83735,Health Care,Biotechnology: Pharmaceutical Preparations
RM,Regional Management Corp. Common Stock,$24.96,0.04,0.161%,245475085.00,United States,2012,2301,Finance,Finance: Consumer Services
RMAX,RE/MAX Holdings Inc. Class A Common Stock,$12.385,-0.145,-1.157%,225869307.00,United States,2013,35557,Finance,Real Estate
RMBI,Richmond Mutual Bancorporation Inc. Common Stock,$11.25,-0.20,-1.747%,126502526.00,United States,2019,2392,,
RMBL,RumbleOn Inc. Class B Common Stock,$7.90,0.42,5.615%,133188462.00,United States,,49621,Technology,EDP Services
RMD,ResMed Inc. Common Stock,$167.505,1.715,1.034%,24638630385.00,United States,,171996,Health Care,Medical/Dental Instruments
RMI,RiverNorth Opportunistic Municipal Income Fund Inc. Common Stock,$15.72,0.09,0.576%,100187773.00,,2018,3175,Finance,Finance/Investors Services
RMM,RiverNorth Managed Duration Municipal Income Fund Inc. Common Stock,$14.44,0.03,0.208%,285040228.00,,2019,50807,Finance,Trusts Except Educational Religious and Charitable
RNAC,Cartesian Therapeutics Inc. Common Stock,$0.6061,-0.0158,-2.541%,94069255.00,United States,2016,327164,Health Care,Biotechnology: Pharmaceutical Preparations
RNGR,Ranger Energy Services Inc. Class A Common Stock,$10.24,-0.38,-3.578%,249986181.00,United States,2017,68048,Energy,Oilfield Services/Equipment
RNR,RenaissanceRe Holdings Ltd. Common Stock,$204.4569,2.0169,0.996%,10462473189.00,Bermuda,,71074,Finance,Property-Casualty Insurers
RNWWW,ReNew Energy Global plc Warrant,$1.12,0.00,0.00%,89646342.00,United Kingdom,,19,Industrials,Environmental Services
ROK,Rockwell Automation Inc. Common Stock,$306.545,2.685,0.884%,35152291628.00,United States,,247130,Industrials,Industrial Machinery/Components
ROKU,Roku Inc. Class A Common Stock,$88.965,2.355,2.719%,12677141694.00,United States,2017,3253039,Telecommunications,Cable & Other Pay Television Services
ROL,Rollins Inc. Common Stock,$42.71,0.47,1.113%,20673256915.00,United States,,448318,Finance,Diversified Commercial Services
ROOT,Root Inc. Class A Common Stock,$10.41,-0.09,-0.857%,151986000.00,United States,2020,27831,Finance,Property-Casualty Insurers
ROP,Roper Technologies Inc. Common Stock,$525.62,-5.38,-1.013%,56147841138.00,United States,1992,208133,Industrials,Industrial Machinery/Components
ROST,Ross Stores Inc. Common Stock,$135.78,1.01,0.749%,45712545597.00,United States,1985,742633,Consumer Discretionary,Clothing/Shoe/Accessory Stores
RPHM,Reneo Pharmaceuticals Inc. Common Stock,$1.65,0.00,0.00%,54964449.00,United States,2021,276006,Health Care,Biotechnology: Pharmaceutical Preparations
RPM,RPM International Inc. Common Stock,$101.96,-5.18,-4.835%,13135329899.00,United States,,861838,Consumer Discretionary,Paints/Coatings
RPRX,Royalty Pharma plc Class A Ordinary Shares ,$27.66,-0.08,-0.288%,16524971471.00,United States,2020,922828,Health Care,Biotechnology: Pharmaceutical Preparations
RPTX,Repare Therapeutics Inc. Common Shares,$7.07,0.06,0.856%,297856633.00,Canada,2020,55238,Health Care,Biotechnology: Pharmaceutical Preparations
RRGB,Red Robin Gourmet Burgers Inc. Common Stock,$11.04,-0.08,-0.719%,170899200.00,United States,2002,41764,Consumer Discretionary,Restaurants
RS,Reliance Steel & Aluminum Co. Common Stock (DE),$279.40,0.27,0.097%,16057461383.00,United States,1994,45083,Industrials,Metal Fabrications
RSF,RiverNorth Capital and Income Fund Common Stock,$15.6655,-0.1145,-0.726%,52347474.00,,2019,4112,Finance,Investment Managers
RSG,Republic Services Inc. Common Stock,$165.19,1.47,0.898%,51974803931.00,United States,1998,179973,Utilities,Environmental Services
RSSS,Research Solutions Inc Common Stock,$2.56,-0.13,-4.833%,75837658.00,United States,,8174,Consumer Discretionary,Business Services
RSVRW,Reservoir Media Inc. Warrant,$1.64,0.02,1.235%,106289769.00,United States,2021,204,Consumer Discretionary,Movies/Entertainment
RTC,Baijiayun Group Ltd. Class A Ordinary Shares,$2.03,0.03,1.50%,59276000.00,China,2006,1762,Industrials,Specialty Chemicals
RTO,Rentokil Initial plc American Depositary Shares (each representing five (5) Ordinary Shares),$26.68,0.32,1.214%,67046840000.00,United States,2022,401382,Consumer Discretionary,Business Services
RTX,RTX Corporation Common Stock,$86.3784,0.7684,0.898%,124203612270.00,United States,,2474338,Industrials,Aerospace
RVPH,Reviva Pharmaceuticals Holdings Inc. Common Stock ,$5.49,0.235,4.472%,124349960.00,United States,2020,186438,Health Care,Biotechnology: Pharmaceutical Preparations
RVSB,Riverview Bancorp Inc Common Stock,$6.26,0.02,0.321%,132155129.00,United States,,4149,Finance,Savings Institutions
RVTY,Revvity Inc. Common Stock,$107.23,2.21,2.104%,13232963492.00,United States,,229846,Industrials,Biotechnology: Laboratory Analytical Instruments
RWLK,ReWalk Robotics Ltd. Ordinary Shares,$1.01,0.01,1.00%,60624889.00,Israel,2014,449662,Health Care,Industrial Specialties
RY,Royal Bank Of Canada Common Stock,$100.47,0.46,0.46%,141312684724.00,Canada,,206280,,
RYAAY,Ryanair Holdings plc American Depositary Shares,$123.325,2.175,1.795%,140245190000.00,Ireland,1997,244276,Consumer Discretionary,Air Freight/Delivery Services
RYAM,Rayonier Advanced Materials Inc. Common Stock,$4.22,-0.06,-1.402%,275749224.00,United States,2014,208601,Basic Materials,Paper
RYAN,Ryan Specialty Holdings Inc. Class A Common Stock,$43.12,0.65,1.53%,16323069575.00,United States,2021,148182,Finance,Specialty Insurers
SACH,Sachem Capital Corp. Common Shares,$3.80,0.05,1.333%,172354430.00,United States,2017,191505,Real Estate,Real Estate Investment Trusts
SAIA,Saia Inc. Common Stock,$425.56,6.77,1.617%,11297740070.00,United States,,95597,Industrials,Trucking Freight/Courier Services
SAMG,Silvercrest Asset Management Group Inc. Class A Common Stock,$16.983,0.153,0.909%,235843991.00,United States,2013,5129,Finance,Investment Managers
SAN,Banco Santander S.A. Sponsored ADR (Spain),$4.20,0.08,1.942%,67973413448.00,Spain,,1808248,Finance,Commercial Banks
SANG,Sangoma Technologies Corporation Common Shares,$2.90,-0.15,-4.918%,96234180.00,Canada,,728,Technology,Computer Software: Programming Data Processing
SAP,SAP  SE ADS,$148.81,-0.98,-0.654%,182813714764.00,Germany,,448183,Technology,EDP Services
SATL,Satellogic Inc. Class A Ordinary Shares,$1.522,-0.138,-8.313%,115337160.00,Uruguay,,16919,Technology,Radio And Television Broadcasting And Communications Equipment
SATX,SatixFy Communications Ltd. Ordinary Share,$0.332,-0.002,-0.599%,26783327768.00,,2022,10821,Technology,Radio And Television Broadcasting And Communications Equipment
SBAC,SBA Communications Corporation Class A Common Stock,$248.98,0.67,0.27%,26861712978.00,United States,1999,229714,Real Estate,Real Estate Investment Trusts
SBFG,SB Financial Group Inc. Common Stock,$15.51,-0.06,-0.385%,105497795.00,United States,,1736,Finance,Major Banks
SBS,Companhia de saneamento Basico Do Estado De Sao Paulo - Sabesp American Depositary Shares (Each repstg 250 Common Shares),$14.70,-0.15,-1.01%,10047595074.00,Brazil,2002,135158,Utilities,Water Supply
SBT,Sterling Bancorp Inc. Common Stock,$5.45,-0.04,-0.729%,283795839.00,United States,2017,3591,Finance,Savings Institutions
SBUX,Starbucks Corporation Common Stock,$93.91,0.68,0.729%,106747497000.00,United States,1992,2947917,Consumer Discretionary,Restaurants
SCCO,Southern Copper Corporation Common Stock,$83.53,-0.36,-0.429%,64577917476.00,United States,,180942,Basic Materials,Metal Mining
SCHW,Charles Schwab Corporation (The) Common Stock,$67.03,-0.02,-0.03%,122167225979.00,United States,,3065443,Finance,Investment Bankers/Brokers/Service
SCI,Service Corporation International Common Stock,$67.90,0.51,0.757%,10031866352.00,United States,,213973,Consumer Discretionary,Other Consumer Services
SCLX,Scilex Holding Company Common Stock,$1.8101,-0.1699,-8.581%,282272399.00,United States,2021,462300,Health Care,Biotechnology: Pharmaceutical Preparations
SCLXW,Scilex Holding Company Warrant,$0.4216,0.0291,7.414%,65745563.00,United States,2021,12659,Health Care,Biotechnology: Pharmaceutical Preparations
SCOR,comScore Inc. Common Stock,$17.78,-0.21,-1.167%,84546674.00,United States,2018,6681,Consumer Discretionary,Business Services
SCPH,scPharmaceuticals Inc. Common Stock,$6.20,-0.15,-2.362%,222335081.00,United States,2017,71390,Health Care,Biotechnology: Pharmaceutical Preparations
SCWO,374Water Inc. Common Stock,$1.30,0.01,0.775%,172467239.00,United States,,35974,Consumer Discretionary,Metal Fabrications
SCX,L.S. Starrett Company (The) Common Stock,$11.645,0.245,2.149%,87147756.00,United States,,12291,Consumer Discretionary,Industrial Machinery/Components
SCYX,SCYNEXIS Inc. Common Stock,$1.93,-0.03,-1.531%,71811052.00,United States,2014,447110,Health Care,Biotechnology: Pharmaceutical Preparations
SDIG,Stronghold Digital Mining Inc. Class A Common Stock,$7.46,1.05,16.381%,59399213.00,United States,2021,2047237,Finance,Investment Bankers/Brokers/Service
SE,Sea Limited American Depositary Shares each representing one Class A Ordinary Share,$38.155,-0.645,-1.662%,21548373617.00,United States,2017,2249131,Consumer Discretionary,Other Consumer Services
SEATW,Vivid Seats Inc. Warrant,$0.97,0.16,19.753%,190517380.00,United States,,7012,Industrials,Industrial Machinery/Components
SEER,Seer Inc. Class A Common Stock,$1.90,0.01,0.529%,121267905.00,United States,2020,161233,Health Care, Medicinal Chemicals and Botanical Products 
SELF,Global Self Storage Inc. Common Stock,$4.676,0.016,0.343%,52104528.00,United States,,3916,Real Estate,Real Estate Investment Trusts
SENEA,Seneca Foods Corp. Class A Common Stock,$52.44,-0.28,-0.531%,286905375.00,United States,,13176,Consumer Staples,Packaged Foods
SENEB,Seneca Foods Corp. Class B Common Stock,$53.77,0.00,0.00%,90169763.00,United States,,2,Consumer Staples,Packaged Foods
SENS,Senseonics Holdings Inc. Common Stock,$0.54,0.0041,0.765%,285271959.00,United States,,1489980,Industrials,Industrial Machinery/Components
SERA,Sera Prognostics Inc. Class A Common Stock,$5.95,0.45,8.182%,186452246.00,United States,2021,87712,Health Care,Precision Instruments
SEVN,Seven Hills Realty Trust Common Stock,$13.67,0.39,2.937%,202471975.00,United States,,108267,Real Estate,Real Estate Investment Trusts
SEZL,Sezzle Inc. Common Stock,$21.00,-0.20,-0.943%,119599767.00,United States,,28947,Finance,Diversified Financial Services
SFBC,Sound Financial Bancorp Inc. Common Stock,$39.00,0.00,0.00%,100179573.00,United States,,9,Finance,Savings Institutions
SFWL,Shengfeng Development Limited Class A Ordinary Shares,$2.69,0.15,5.906%,108998800.00,China,2023,326422,Industrials,Trucking Freight/Courier Services
SGA,Saga Communications Inc. Class A Common Stock (FL),$23.24,0.11,0.476%,142310814.00,United States,,8240,Consumer Discretionary,Broadcasting
SGC,Superior Group of Companies Inc. Common Stock,$13.89,0.18,1.313%,229265923.00,United States,,28038,Consumer Discretionary,Apparel
SGHT,Sight Sciences Inc. Common Stock,$5.02,-0.04,-0.791%,244724378.00,United States,2021,142287,Health Care,Medical Specialities
SGMO,Sangamo Therapeutics Inc. Common Stock,$0.4931,-0.0417,-7.797%,87449796.00,United States,2000,900752,Health Care,Biotechnology: Biological Products (No Diagnostic Substances)
SGMT,Sagimet Biosciences Inc. Series A Common Stock,$5.04,-0.22,-4.183%,107732026.00,United States,2023,35728,,
SHEL,Shell PLC American Depositary Shares (each representing two (2) Ordinary Shares) ,$66.695,-0.235,-0.351%,446230300645.00,Netherlands,2022,2004727,Energy,Oil & Gas Production
SHFS,SHF Holdings Inc. Class A Common Stock,$1.28,0.02,1.587%,59639446.00,United States,2021,33886,Finance,Finance: Consumer Services
SHG,Shinhan Financial Group Co Ltd American Depositary Shares,$28.5905,-0.5395,-1.852%,14546413797.00,South Korea,,74623,Finance,Major Banks
SHIM,Shimmick Corporation Common Stock,$6.56,-0.09,-1.353%,167239833.00,United States,2023,1044,,
SHIP,Seanergy Maritime Holdings Corp. Common Stock,$7.9547,0.2047,2.641%,159173547.00,Greece,,204570,,
SHLT,SHL Telemedicine Ltd American Depositary Shares,$8.20,0.00,0.00%,134377910.00,Israel,,41,Consumer Discretionary,Business Services
SHOP,Shopify Inc. Class A Subordinate Voting Shares,$73.28,1.46,2.033%,94110488381.00,Canada,2015,4554600,,
SHOT,Safety Shot Inc. Common Stock,$3.50,0.04,1.156%,139362241.00,United States,2020,731654,Health Care,Biotechnology: Pharmaceutical Preparations
SHOTW,Safety Shot Inc. Warrant,$1.3255,-0.1445,-9.83%,52778471.00,United States,2020,14415,Health Care,Biotechnology: Pharmaceutical Preparations
SHW,Sherwin-Williams Company (The) Common Stock,$296.46,-0.31,-0.104%,75883707041.00,United States,,519070,Consumer Discretionary,RETAIL: Building Materials
SIEB,Siebert Financial Corp. Common Stock,$1.6899,0.0699,4.315%,66887824.00,United States,,21701,Finance,Investment Bankers/Brokers/Service
SILC,Silicom Ltd Ordinary Shares,$17.40,-0.24,-1.361%,117624000.00,Israel,,7388,Technology,Computer Manufacturing
SIRI,Sirius XM Holdings Inc. Common Stock,$5.40,-0.04,-0.735%,20730275033.00,United States,,3578323,Consumer Discretionary,Broadcasting
SJ,Scienjoy Holding Corporation Class A Ordinary Shares ,$3.1731,-0.1069,-3.259%,119561729.00,China,2019,1101,Technology,EDP Services
SJM,The J.M. Smucker Company Common Stock,$128.62,-1.17,-0.901%,13652216585.00,United States,,289632,Consumer Staples,Packaged Foods
SJT,San Juan Basin Royalty Trust Common Stock,$5.495,0.105,1.948%,256115334.00,United States,,348872,Energy,Oil & Gas Production
SKIL,Skillsoft Corp. Class A Common Stock,$14.93,-1.21,-7.497%,120467527.00,United States,2019,17335,Technology,Computer Software: Prepackaged Software
SKLZ,Skillz Inc. Class A Common Stock,$5.6674,0.0574,1.023%,121552468.00,United States,2020,55266,Technology,EDP Services
SKYX,SKYX Platforms Corp. Common Stock,$1.81,0.05,2.841%,166821208.00,United States,2022,115893,Consumer Discretionary,Building Products
SLAC,Social Leverage Acquisition Corp I Class A Common Stock,$10.45,0.00,0.00%,106403300.00,United States,,1,Finance,Finance: Consumer Services
SLB,Schlumberger N.V. Common Stock,$52.29,-0.36,-0.684%,74430665318.00,France,,2601198,Energy,Oilfield Services/Equipment
SLDB,Solid Biosciences Inc. Common Stock,$5.53,-0.23,-3.993%,111581243.00,United States,2018,59603,Health Care,Biotechnology: Biological Products (No Diagnostic Substances)
SLDP,Solid Power Inc. Class A Common Stock,$1.40,0.11,8.527%,249812314.00,United States,2021,2480227,Energy,Electrical Products
SLF,Sun Life Financial Inc. Common Stock,$51.37,0.22,0.43%,30015254698.00,Canada,,171386,Finance,Life Insurance
SLMBP,SLM Corporation Floating Rate Non-Cumulative Preferred Stock Series B,$67.20,0.10,0.149%,15205415030.00,United States,,2568,Finance,Finance: Consumer Services
SLND,Southland Holdings Inc. Common Stock,$5.25,0.02,0.382%,251432916.00,United States,,104356,Industrials,Military/Government/Technical
SLNG,Stabilis Solutions Inc. Common Stock,$4.19,0.00,0.00%,77822508.00,United States,,83,Utilities,Oil/Gas Transmission
SLQT,SelectQuote Inc. Common Stock,$1.265,-0.015,-1.172%,212182365.00,United States,2020,192879,Finance,Specialty Insurers
SMCI,Super Micro Computer Inc. Common Stock,$291.57,10.93,3.895%,15544629441.00,United States,2020,1325821,Technology,Computer Manufacturing
SMFG,Sumitomo Mitsui Financial Group Inc Unsponsored American Depositary Shares (Japan),$9.665,0.065,0.677%,66416048579.00,Japan,,567591,Finance,Commercial Banks
SMID,Smith-Midland Corporation Common Stock,$40.2601,1.2901,3.31%,211663973.00,United States,,23548,Industrials,Building Materials
SMLP,Summit Midstream Partners LP Common Units Representing Limited Partner Interests,$17.99,0.03,0.167%,186667640.00,United States,2012,12425,Utilities,Natural Gas Distribution
SMLR,Semler Scientific Inc. Common Stock,$43.4038,0.3638,0.845%,298322825.00,United States,,19944,Health Care,Biotechnology: Electromedical & Electrotherapeutic Apparatus
SMSI,Smith Micro Software Inc. Common Stock,$0.8109,-0.0342,-4.047%,58324677.00,United States,1995,102885,Technology,Computer Software: Prepackaged Software
SNA,Snap-On Incorporated Common Stock,$282.82,-0.02,-0.007%,14927228004.00,United States,,31431,Consumer Discretionary,Industrial Machinery/Components
SNAP,Snap Inc. Class A Common Stock,$16.155,0.375,2.376%,26597519060.00,United States,2017,6594693,Technology,Computer Software: Programming Data Processing
SNCR,Synchronoss Technologies Inc. Common Stock,$5.60,-0.45,-7.438%,58076211.00,United States,2018,48647,Technology,EDP Services
SND,Smart Sand Inc. Common Stock,$2.15,-0.04,-1.826%,88785549.00,United States,2016,168962,Industrials,Mining & Quarrying of Nonmetallic Minerals (No Fuels)
SNDA,Sonida Senior Living Inc. Common Stock,$9.94,0.905,10.017%,81287789.00,United States,,225,Health Care,Hospital/Nursing Management
SNFCA,Security National Financial Corporation Class A Common Stock,$8.55,-0.29,-3.281%,196477889.00,United States,,14415,Finance,Finance: Consumer Services
SNN,Smith & Nephew SNATS Inc. Common Stock,$26.5204,0.0904,0.342%,11581443961.00,United Kingdom,,302244,Health Care,Industrial Specialties
SNOW,Snowflake Inc. Class A Common Stock,$185.22,1.01,0.548%,60992946000.00,United States,2020,2099941,Technology,Computer Software: Prepackaged Software
SNPS,Synopsys Inc. Common Stock,$491.51,-0.89,-0.181%,74703070406.00,United States,1992,372667,Technology,Computer Software: Prepackaged Software
SNY,Sanofi ADS,$50.96,0.35,0.692%,128504377805.00,France,,557369,Health Care,Biotechnology: Pharmaceutical Preparations
SO,Southern Company (The) Common Stock,$72.24,0.00,0.00%,78786341772.00,United States,,1104898,Utilities,Power Generation
SOAR,Volato Group Inc. Class A Common Stock,$3.915,-0.0228,-0.579%,52238229.00,,2022,19803,Finance,Blank Checks
SOJE,Southern Company (The) Series 2020C 4.20% Junior Subordinated Notes due October 15 2060,$19.9202,0.1002,0.506%,15400515165.00,United States,2020,14910,Basic Materials,Metal Mining
SOL,Emeren Group Ltd American Depositary Shares each representing 10 shares,$2.5801,-0.0099,-0.382%,155515117.00,China,2008,156711,Technology,Semiconductors
SONY,Sony Group Corporation American Depositary Shares ,$91.19,-1.19,-1.288%,114998067580.00,Japan,,512395,Consumer Staples,Consumer Electronics/Appliances
SOTK,Sono-Tek Corporation Common Stock,$5.29,-0.09,-1.673%,83283025.00,United States,,1557,Technology,Industrial Machinery/Components
SOUNW,SoundHound AI Inc. Warrant,$0.38,0.0131,3.57%,93831231.00,United States,2021,17092,Technology,EDP Services
SPG,Simon Property Group Inc. Common Stock,$140.18,0.09,0.064%,45733362354.00,United States,,324032,Real Estate,Real Estate Investment Trusts
SPGI,S&P Global Inc. Common Stock,$431.31,1.45,0.337%,136639008000.00,United States,,376963,Finance,Finance: Consumer Services
SPIR,Spire Global Inc. Class A Common Stock,$7.3401,-0.1299,-1.739%,164124284.00,United States,2020,63996,Consumer Discretionary,Telecommunications Equipment
SPLK,Splunk Inc. Common Stock,$152.145,-0.005,-0.003%,25636432500.00,United States,2012,730006,Technology,Computer Software: Prepackaged Software
SPOT,Spotify Technology S.A. Ordinary Shares,$195.20,7.26,3.863%,37730208000.00,Luxembourg,2018,1431971,Consumer Discretionary,Broadcasting
SPRB,Spruce Biosciences Inc. Common Stock,$2.87,0.14,5.128%,116839686.00,United States,2020,184900,Health Care, Medicinal Chemicals and Botanical Products 
SPRO,Spero Therapeutics Inc. Common Stock,$1.44,-0.03,-2.041%,76319016.00,United States,2017,97923,Health Care,Biotechnology: Pharmaceutical Preparations
SPRU,Spruce Power Holding Corporation Class A Common Stock,$4.4725,-0.1675,-3.61%,81516541.00,United States,2019,9801,Consumer Discretionary,Auto Parts:O.E.M.
