Symbol,Name,Last Sale,Net Change,% Change,Market Cap,Country,IPO Year,Volume,Sector,Industry
IMAB,I-MAB American Depositary Shares,$2.20,-0.11,-4.762%,182580792.00,China,2020,548688,Health Care,Biotechnology: Pharmaceutical Preparations
IMMR,Immersion Corporation Common Stock,$6.8635,-0.0565,-0.816%,218533744.00,United States,1999,78397,Technology,Computer peripheral equipment
IMMX,Immix Biopharma Inc. Common Stock,$6.05,-0.05,-0.82%,120196705.00,United States,2021,40263,Health Care, Medicinal Chemicals and Botanical Products 
IMO,Imperial Oil Limited Common Stock,$59.75,-0.03,-0.05%,33858360301.00,Canada,1929,234450,,
IMRX,Immuneering Corporation Class A Common Stock,$6.50,-0.06,-0.915%,190249287.00,United States,2021,20305,Health Care,Biotechnology: Pharmaceutical Preparations
IMTXW,Immatics N.V. Warrants,$3.12,0.12,4.00%,239212581.00,Germany,,1109,Health Care,Biotechnology: Biological Products (No Diagnostic Substances)
IMUX,Immunic Inc. Common Stock,$1.41,-0.02,-1.399%,63654990.00,United States,2014,46918,Health Care,Biotechnology: Pharmaceutical Preparations
INBK,First Internet Bancorp Common Stock,$24.40,1.15,4.946%,210905621.00,United States,,34246,Finance,Major Banks
INBKZ,First Internet Bancorp 6.0% Fixed-to-Floating Rate Subordinated Notes Due 2029,$22.00,0.20,0.917%,190160806.00,United States,,225,Finance,Major Banks
INCR,Intercure Ltd. Ordinary Shares,$1.35,0.085,6.719%,61523130.00,Israel,,23266,Health Care,Biotechnology: Pharmaceutical Preparations
INCY,Incyte Corp. Common Stock,$67.36,1.85,2.824%,15095998272.00,United States,,1227155,Health Care,Biotechnology: Commercial Physical & Biological Resarch
INFU,InfuSystems Holdings Inc. Common Stock,$9.76,-0.11,-1.114%,206751214.00,United States,,3111,Health Care,Medical/Dental Instruments
INFY,Infosys Limited American Depositary Shares,$18.015,-0.025,-0.139%,75784396618.00,India,,3977745,Technology,EDP Services
ING,ING Group N.V. Common Stock,$14.475,-0.185,-1.262%,53941658915.00,Netherlands,1997,1875449,Finance,Commercial Banks
INGN,Inogen Inc Common Stock,$5.27,-0.005,-0.095%,122832180.00,United States,2014,75799,Health Care,Industrial Specialties
INMB,INmune Bio Inc. Common stock,$11.94,0.79,7.085%,215179002.00,United States,2019,43286,Health Care,Biotechnology: Biological Products (No Diagnostic Substances)
INO,Inovio Pharmaceuticals Inc. Common Stock,$0.58,0.0594,11.41%,158332126.00,United States,,8837737,Health Care,Medical/Dental Instruments
INOD,Innodata Inc. Common Stock,$7.8287,0.1187,1.54%,224758423.00,United States,1993,104889,Technology,EDP Services
INSE,Inspired Entertainment Inc. Common Stock,$9.69,0.05,0.519%,255201518.00,United States,2014,31144,Technology,Computer Software: Prepackaged Software
INTC,Intel Corporation Common Stock,$46.74,-0.31,-0.659%,197055840000.00,United States,,29021462,Technology,Semiconductors
INTS,Intensity Therapeutics Inc. Common stock,$8.19,0.20,2.503%,112279798.00,United States,2023,35035,Health Care,Biotechnology: Pharmaceutical Preparations
INTT,inTest Corporation Common Stock,$12.71,0.05,0.395%,154570276.00,United States,1997,39666,Industrials,Electrical Products
INTU,Intuit Inc. Common Stock,$589.725,-1.415,-0.239%,165085257600.00,United States,1993,313501,Technology,Computer Software: Prepackaged Software
INUV,Inuvo Inc.,$0.509,0.0349,7.361%,70232674.00,United States,,587983,Consumer Discretionary,Advertising
INVE,Identiv Inc. Common Stock,$7.93,0.17,2.191%,183772603.00,United States,,8931,Technology,Computer peripheral equipment
INVH,Invitation Homes Inc. Common Stock,$33.815,-0.255,-0.748%,20693367852.00,United States,2017,626599,Real Estate,Real Estate Investment Trusts
INVZW,Innoviz Technologies Ltd. Warrant,$0.39,-0.0825,-17.46%,53112253.00,Israel,,800,Consumer Discretionary,Auto Parts:O.E.M.
INZY,Inozyme Pharma Inc. Common Stock,$4.095,-0.075,-1.799%,252910263.00,United States,2020,131944,Health Care,Biotechnology: Pharmaceutical Preparations
IOBT,IO Biotech Inc. Common Stock,$1.93,-0.01,-0.515%,127150164.00,Denmark,2021,65109,Health Care,Biotechnology: Pharmaceutical Preparations
IONR,ioneer Ltd American Depositary Shares,$4.1776,0.0976,2.392%,219200581.00,Australia,,4402,,
IOR,Income Opportunity Realty Investors Inc. Common Stock,$13.75,0.35,2.612%,57315693.00,United States,1987,2007,Real Estate,Real Estate Investment Trusts
IOT,Samsara Inc. Class A Common Stock,$30.343,0.023,0.076%,16391161675.00,United States,2021,891109,Technology,Retail: Computer Software & Peripheral Equipment
IP,International Paper Company Common Stock,$36.51,0.16,0.44%,12633092098.00,United States,,623446,Basic Materials,Paper
IPG,Interpublic Group of Companies Inc. (The) Common Stock,$32.26,0.14,0.436%,12355713266.00,United States,,1340149,Consumer Discretionary,Advertising
IPHA,Innate Pharma S.A. ADS,$2.84,0.06,2.158%,225901061.00,France,2019,86764,Health Care,Biotechnology: Pharmaceutical Preparations
IPI,Intrepid Potash Inc Common Stock,$21.895,-0.755,-3.333%,288064151.00,United States,2008,32892,Industrials,Mining & Quarrying of Nonmetallic Minerals (No Fuels)
IPSC,Century Therapeutics Inc. Common Stock,$3.23,-0.10,-3.003%,193266947.00,United States,2021,62157,Health Care, Medicinal Chemicals and Botanical Products 
IPX,IperionX Limited American Depositary Share,$9.595,0.045,0.471%,185657464.00,United States,,3467,Consumer Discretionary,Diversified Commercial Services
IQV,IQVIA Holdings Inc. Common Stock,$220.46,0.45,0.205%,40233950000.00,United States,2013,218757,Health Care,Biotechnology: Commercial Physical & Biological Resarch
IR,Ingersoll Rand Inc. Common Stock,$75.61,0.89,1.191%,30606699355.00,United States,2017,366492,Industrials,Industrial Machinery/Components
IRM,Iron Mountain Incorporated (Delaware)Common Stock REIT,$66.84,0.62,0.936%,19516582725.00,United States,,565417,Real Estate,Real Estate Investment Trusts
IROQ,IF Bancorp Inc. Common Stock,$15.705,-0.495,-3.056%,52684401.00,United States,2011,2274,Finance,Finance: Consumer Services
ISDR,Issuer Direct Corporation Common Stock,$16.43,-0.91,-5.248%,62625393.00,United States,,2859,Consumer Discretionary,Publishing
ISRG,Intuitive Surgical Inc. Common Stock,$323.84,1.71,0.531%,114014864353.00,United States,2000,461331,Health Care,Medical/Dental Instruments
ISSC,Innovative Solutions and Support Inc. Common Stock,$8.305,0.015,0.181%,144897252.00,United States,2000,10692,Technology,EDP Services
ISTR,Investar Holding Corporation Common Stock,$15.71,0.87,5.863%,153324698.00,United States,2014,89490,Finance,Major Banks
IT,Gartner Inc. Common Stock,$428.58,1.04,0.243%,33407216131.00,United States,1993,99667,Consumer Discretionary,Other Consumer Services
ITI,Iteris Inc. Common Stock,$4.803,-0.117,-2.378%,205677923.00,United States,,70436,Telecommunications,Telecommunications Equipment
ITIC,Investors Title Company Common Stock,$158.09,0.00,0.00%,298888590.00,United States,,163,Finance,Specialty Insurers
ITRG,Integra Resources Corp. Common Shares,$1.00,-0.02,-1.961%,68777526.00,,,37330,Basic Materials,Precious Metals
ITUB,Itau Unibanco Banco Holding SA American Depositary Shares (Each repstg 500 Preferred shares),$6.705,-0.045,-0.667%,65736727508.00,Brazil,,8006450,Finance,Major Banks
ITW,Illinois Tool Works Inc. Common Stock,$260.83,2.53,0.979%,78480064080.00,United States,,260320,Industrials,Industrial Machinery/Components
IVA,Inventiva S.A. American Depository Shares,$4.44,-0.20,-4.31%,187075710.00,France,2020,237,Health Care,Biotechnology: Pharmaceutical Preparations
IVAC,Intevac Inc. Common Stock,$4.27,0.01,0.235%,112614649.00,United States,1995,13735,Technology,Industrial Machinery/Components
IX,Orix Corp Ads Common Stock,$93.53,1.44,1.564%,23099091754.00,Japan,,5321,Finance,Diversified Financial Services
IXHL,Incannex Healthcare Inc. Common Stock,$4.20,-0.10,-2.326%,66667075.00,Australia,,3020,,
IZM,ICZOOM Group Inc. Class A Ordinary Shares,$10.50,0.02,0.191%,108886659.00,China,2023,172474,Consumer Discretionary,Consumer Electronics/Video Chains
J,Jacobs Solutions Inc. Common Stock,$127.205,0.385,0.304%,16030938000.00,United States,2022,133558,Industrials,Military/Government/Technical
JBHT,J.B. Hunt Transport Services Inc. Common Stock,$190.25,-1.70,-0.886%,19622918651.00,United States,,356382,Industrials,Trucking Freight/Courier Services
JBL,Jabil Inc. Common Stock,$126.41,-0.94,-0.738%,16173535540.00,United States,1993,1037046,Technology,Electrical Products
JCI,Johnson Controls International plc Ordinary Share,$56.85,0.81,1.445%,38696307747.00,Switzerland,,1851019,Industrials,Industrial Machinery/Components
JD,JD.com Inc. American Depositary Shares,$27.255,-0.215,-0.783%,42831463132.00,China,2014,3644216,Consumer Discretionary,Other Specialty Stores
JEQ,abrdn Japan Equity Fund Inc. Common Stock,$5.6816,0.0016,0.028%,77269703.00,United States,1992,4261,Consumer Discretionary,Air Freight/Delivery Services
JFIN,Jiayin Group Inc. American Depositary Shares,$5.1342,-0.0258,-0.50%,274329809.00,China,2019,11119,Finance,Finance: Consumer Services
JHI,John Hancock Investors Trust Common Stock,$12.91,-0.03,-0.232%,112892102.00,United States,,12413,Finance,Trusts Except Educational Religious and Charitable
JHS,John Hancock Income Securities Trust Common Stock,$10.85,-0.06,-0.55%,126365447.00,United States,,4768,Finance,Finance Companies
JHX,James Hardie Industries plc American Depositary Shares (Ireland),$36.805,0.065,0.177%,16269881974.00,Ireland,,13301,Industrials,Building Materials
JILL,J. Jill Inc. Common Stock,$25.155,0.235,0.943%,266711044.00,United States,2017,30797,Consumer Discretionary,Clothing/Shoe/Accessory Stores
JKHY,Jack Henry & Associates Inc. Common Stock,$165.73,2.30,1.407%,12069817917.00,United States,1985,288775,Technology,EDP Services
JNJ,Johnson & Johnson Common Stock,$161.17,0.20,0.124%,387981095185.00,United States,,2064878,Health Care,Biotechnology: Pharmaceutical Preparations
JOB,GEE Group Inc. Common Stock,$0.49,0.0008,0.164%,53455277.00,United States,1968,95139,Consumer Discretionary,Diversified Commercial Services
JPM,JP Morgan Chase & Co. Common Stock,$172.3499,1.0199,0.595%,498264998471.00,United States,,4836930,Finance,Major Banks
JSPR,Jasper Therapeutics Inc. Common Stock,$6.65,-0.34,-4.864%,73338448.00,United States,2020,58477,Health Care,Biotechnology: Pharmaceutical Preparations
JYNT,The Joint Corp. Common Stock,$9.035,0.005,0.055%,133304983.00,United States,2014,36503,Miscellaneous,Multi-Sector Companies
K,Kellanova Common Stock,$57.38,-0.10,-0.174%,19653782853.00,United States,,632516,Consumer Staples,Packaged Foods
KB,KB Financial Group Inc,$39.41,-0.77,-1.916%,15355489142.00,South Korea,,91555,Finance,Commercial Banks
KDP,Keurig Dr Pepper Inc. Common Stock,$32.525,0.15,0.463%,45480881750.00,United States,,1926477,Consumer Staples,Beverages (Production/Distribution)
KEQU,Kewaunee Scientific Corporation Common Stock,$28.8501,0.2601,0.91%,83713499.00,United States,,5143,Industrials,Medical Specialities
KEY,KeyCorp Common Stock,$14.375,0.195,1.375%,13458741252.00,United States,,7864170,Finance,Major Banks
KEYS,Keysight Technologies Inc. Common Stock,$150.1525,-0.4975,-0.33%,26283384902.00,United States,2014,347143,Industrials,Industrial Machinery/Components
KFS,Kingsway Financial Services Inc. Common Stock (DE),$8.31,-0.03,-0.36%,235102357.00,Canada,,19795,Finance,Property-Casualty Insurers
KGEI,Kolibri Global Energy Inc. Common stock,$3.59,-0.18,-4.775%,127895857.00,United States,,13447,,
KHC,The Kraft Heinz Company Common Stock,$37.925,-0.155,-0.407%,46516479970.00,United States,,3067620,Consumer Staples,Packaged Foods
KIM,Kimco Realty Corporation (HC) Common Stock,$20.805,0.085,0.41%,12896482107.00,United States,,1926233,Real Estate,Real Estate Investment Trusts
KKR,KKR & Co. Inc. Common Stock,$80.20,0.31,0.388%,70977695815.00,United States,,682988,Finance,Investment Managers
KLAC,KLA Corporation Common Stock,$550.35,-2.24,-0.405%,74810350111.00,United States,1980,263122,Technology,Electronic Components
KLTR,Kaltura Inc. Common Stock,$1.76,-0.01,-0.565%,248873904.00,United States,2021,105849,Technology,EDP Services
KLXE,KLX Energy Services Holdings Inc. Common Stock,$10.82,-0.32,-2.873%,177528414.00,United States,,31924,Energy,Oilfield Services/Equipment
KMB,Kimberly-Clark Corporation Common Stock,$122.74,1.00,0.821%,41478880918.00,United States,,596756,Consumer Discretionary,Containers/Packaging
KMDA,Kamada Ltd. Ordinary Shares,$6.13,0.03,0.492%,274869200.00,Israel,2013,10509,Health Care,Biotechnology: Pharmaceutical Preparations
KMI,Kinder Morgan Inc. Common Stock,$18.015,-0.035,-0.194%,40043272403.00,United States,2011,4456420,Utilities,Natural Gas Distribution
KMX,CarMax Inc,$72.065,-0.465,-0.641%,11434425923.00,United States,,616850,Consumer Discretionary,Retail-Auto Dealers and Gas Stations
KNDI,Kandi Technologies Group Inc Common Stock,$2.79,-0.01,-0.357%,244188612.00,China,,44536,Consumer Discretionary,Auto Manufacturing
KNOP,KNOT Offshore Partners LP Common Units representing Limited Partner Interests,$6.18,-0.12,-1.905%,210429000.00,United Kingdom,2013,54364,Consumer Discretionary,Marine Transportation
KNTE,Kinnate Biopharma Inc. Common Stock,$2.55,0.02,0.791%,120137380.00,United States,2020,98883,Health Care,Biotechnology: Pharmaceutical Preparations
KO,Coca-Cola Company (The) Common Stock,$60.045,0.085,0.142%,259599382221.00,United States,,4028579,Consumer Staples,Beverages (Production/Distribution)
KOD,Kodiak Sciences Inc Common Stock,$3.025,0.005,0.166%,158728680.00,United States,2018,136201,Health Care,Biotechnology: Biological Products (No Diagnostic Substances)
KODK,Eastman Kodak Company Common New,$3.63,-0.04,-1.09%,288777267.00,United States,,211897,Consumer Discretionary,Industrial Machinery/Components
KOF,Coca Cola Femsa S.A.B. de C.V.  American Depositary Shares each representing 10 Units (each Unit consists of 3 Series B Shares and 5 Series L Shares),$90.73,-1.08,-1.176%,19060851095.00,Mexico,1993,69563,Consumer Staples,Beverages (Production/Distribution)
KOPN,Kopin Corporation Common Stock,$2.1009,0.1109,5.573%,240446186.00,United States,1992,808054,Technology,Industrial Machinery/Components
KORE,KORE Group Holdings Inc. Common Stock,$0.98,0.22,28.947%,84976370.00,United States,,114587,Consumer Discretionary,Telecommunications Equipment
KPTI,Karyopharm Therapeutics Inc. Common Stock,$0.8176,-0.0155,-1.861%,93642991.00,United States,2013,557196,Miscellaneous,Diversified Commercial Services
KR,Kroger Company (The) Common Stock,$46.08,-0.44,-0.946%,33151032438.00,United States,,1649441,Consumer Staples,Food Chains
KRMD,KORU Medical Systems Inc. Common Stock (DE),$2.17,-0.06,-2.691%,99102516.00,United States,,37051,Health Care,Medical/Dental Instruments
KRON,Kronos Bio Inc. Common Stock,$1.18,0.06,5.357%,68813494.00,United States,2020,51561,Health Care, Medicinal Chemicals and Botanical Products 
KRTX,Karuna Therapeutics Inc. Common Stock,$315.06,0.90,0.286%,11886305482.00,United States,2019,861381,Health Care,Biotechnology: Pharmaceutical Preparations
KVHI,KVH Industries Inc. Common Stock,$4.98,-0.22,-4.231%,97661734.00,United States,1996,17745,Technology,Radio And Television Broadcasting And Communications Equipment
KVUE,Kenvue Inc. Common Stock,$21.075,-0.195,-0.917%,40358521416.00,United States,2023,8346090,Consumer Discretionary,Specialty Chemicals
KZR,Kezar Life Sciences Inc. Common Stock,$0.8988,-0.0017,-0.189%,65336435.00,United States,2018,110337,Health Care,Biotechnology: Pharmaceutical Preparations
L,Loews Corporation Common Stock,$71.02,0.75,1.067%,15855260595.00,United States,,136225,Finance,Property-Casualty Insurers
LAB,Standard BioTools Inc. Common Stock,$1.995,-0.045,-2.206%,158393095.00,United States,2011,119924,Industrials,Biotechnology: Laboratory Analytical Instruments
LAKE,Lakeland Industries Inc. Common Stock,$17.65,-0.25,-1.397%,129987961.00,United States,1986,4506,Health Care,Industrial Specialties
LAMR,Lamar Advertising Company Class A Common Stock,$101.94,0.91,0.901%,10397702726.00,United States,1996,189818,Real Estate,Real Estate Investment Trusts
LARK,Landmark Bancorp Inc. Common Stock,$19.39,-0.02,-0.103%,106292199.00,United States,,2669,Finance,Major Banks
LATG,Chenghe Acquisition I Co. Class A Ordinary Shares,$11.03,0.00,0.00%,179237500.00,Mexico,2022,2,Finance,Blank Checks
LAZY,Lazydays Holdings Inc. Common Stock,$5.8399,-0.0101,-0.173%,81922333.00,United States,,81846,Consumer Discretionary,Retail-Auto Dealers and Gas Stations
LBRDA,Liberty Broadband Corporation Class A Common Stock,$77.375,-2.605,-3.257%,11301866112.00,United States,,37460,Telecommunications,Cable & Other Pay Television Services
LBRDK,Liberty Broadband Corporation Class C Common Stock,$77.56,-2.49,-3.111%,11328888345.00,United States,,290408,Telecommunications,Cable & Other Pay Television Services
LCA,Landcadia Holdings IV Inc. Class A Common Stock,$10.42,0.0199,0.191%,144395536.00,United States,2021,510,Finance,Blank Checks
LCNB,LCNB Corporation Common Stock,$15.865,0.005,0.032%,176483402.00,United States,,5098,Finance,Major Banks
LCTX,Lineage Cell Therapeutics Inc. Common Stock,$1.19,-0.02,-1.653%,208234138.00,United States,,341954,Health Care,Biotechnology: Biological Products (No Diagnostic Substances)
LCUT,Lifetime Brands Inc. Common Stock,$6.51,0.01,0.154%,142010676.00,United States,1991,32922,Consumer Discretionary,Industrial Machinery/Components
LDOS,Leidos Holdings Inc. Common Stock,$108.00,0.34,0.316%,14850694224.00,United States,,188347,Technology,EDP Services
LDTC,LeddarTech Holdings Inc. Common Shares,$2.80,0.13,4.869%,80558750.00,United States,2021,31896,Finance,Blank Checks
LE,Lands' End Inc. Common Stock,$9.05,-0.03,-0.33%,284583703.00,United States,,24170,Consumer Discretionary,Clothing/Shoe/Accessory Stores
LECO,Lincoln Electric Holdings Inc. Common Shares,$212.495,2.845,1.357%,12154657901.00,United States,,57302,Industrials,Industrial Machinery/Components
LEN,Lennar Corporation Class A Common Stock,$146.49,0.83,0.57%,41655149155.00,United States,,464715,Consumer Discretionary,Homebuilding
LFCR,Lifecore Biomedical Inc. Common Stock,$6.30,-0.05,-0.787%,191029665.00,United States,,27682,Health Care,Biotechnology: Pharmaceutical Preparations
LFMD,LifeMD Inc. Common Stock,$5.45,-2.32,-29.858%,206984482.00,United States,,4111035,Health Care,Medical/Nursing Services
LFT,Lument Finance Trust Inc. Common Stock,$2.3199,0.0099,0.429%,121171050.00,United States,2013,21860,Real Estate,Real Estate Investment Trusts
LFVN,Lifevantage Corporation Common Stock (Delaware),$5.71,-0.15,-2.56%,72596295.00,United States,,8254,Health Care,Biotechnology: Pharmaceutical Preparations
LGO,Largo Inc. Common Shares,$2.33,0.01,0.431%,149238830.00,Canada,,12584,Industrials,Mining & Quarrying of Nonmetallic Minerals (No Fuels)
LH,Laboratory Corporation of America Holdings Common Stock,$226.11,-0.59,-0.26%,19196739000.00,United States,,120029,Health Care,Medical Specialities
LHX,L3Harris Technologies Inc. Common Stock,$209.38,-0.44,-0.21%,39685937336.00,United States,,269337,Industrials,Industrial Machinery/Components
LI,Li Auto Inc. American Depositary Shares,$35.39,-0.35,-0.979%,36503215312.00,China,2020,2454463,Consumer Discretionary,Auto Manufacturing
LICY,Li-Cycle Holdings Corp. Common Shares,$0.5438,-0.0062,-1.127%,96002452.00,Canada,2021,2129554,Industrials,Environmental Services
LIFE,aTyr Pharma Inc. Common Stock,$1.535,-0.02,-1.286%,89889694.00,United States,2015,173710,Health Care,Biotechnology: Biological Products (No Diagnostic Substances)
LIFW,MSP Recovery Inc. Class A Common Stock,$2.11,-0.04,-1.86%,292397343.00,United States,2020,68640,Technology,Computer Software: Prepackaged Software
LII,Lennox International Inc. Common Stock,$433.235,3.295,0.766%,15397052760.00,United States,1999,64255,Industrials,Industrial Machinery/Components
LILA,Liberty Latin America Ltd. Class A Common Stock,$6.98,-0.08,-1.133%,284784000.00,United States,,91976,Telecommunications,Cable & Other Pay Television Services
LILMW,Lilium N.V. Warrants,$0.1488,0.0028,1.918%,58520642.00,Germany,,3199,Industrials,Aerospace
LIN,Linde plc Ordinary Shares,$409.96,1.25,0.306%,198785703641.00,United States,,379857,Industrials,Major Chemicals
LINC,Lincoln Educational Services Corporation Common Stock,$9.26,-0.12,-1.279%,290385359.00,United States,2005,17541,Real Estate,Other Consumer Services
LINK,Interlink Electronics Inc. Common Stock,$12.24,0.24,2.00%,80460497.00,United States,,2163,Technology,Industrial Machinery/Components
LITB,LightInTheBox Holding Co. Ltd. American Depositary Shares each representing 2 ordinary shares,$1.07,-0.035,-3.167%,121214619.00,China,2013,41454,Consumer Discretionary,Catalog/Specialty Distribution
LIVE,Live Ventures Incorporated Common Stock,$26.20,0.50,1.946%,82855273.00,United States,,193,Consumer Discretionary,Other Specialty Stores
LKQ,LKQ Corporation Common Stock,$46.44,-0.19,-0.407%,12427265934.00,United States,2003,410644,Consumer Discretionary,Motor Vehicles
LL,LL Flooring Holdings Inc. Common Stock,$3.45,-0.01,-0.289%,106476494.00,United States,2007,50054,Consumer Discretionary,RETAIL: Building Materials
LLAP,Terran Orbital Corporation Common Stock,$1.1877,-0.0523,-4.218%,230961758.00,United States,2021,1185330,Industrials,Military/Government/Technical
LLY,Eli Lilly and Company Common Stock,$624.81,7.11,1.151%,593136654750.00,United States,,3788619,Health Care,Biotechnology: Pharmaceutical Preparations
LMT,Lockheed Martin Corporation Common Stock,$463.48,4.36,0.95%,114988792428.00,United States,,307109,Industrials,Aerospace
LNG,Cheniere Energy Inc. Common Stock,$171.064,1.704,1.006%,40756830397.00,United States,2001,564077,Utilities,Oil/Gas Transmission
LNKB,LINKBANCORP Inc. Common Stock,$8.145,0.145,1.813%,132300750.00,United States,,32622,,
LNSR,LENSAR Inc. Common Stock,$4.50,0.43,10.565%,50618282.00,United States,,19044,Health Care,Medical Electronics
LNT,Alliant Energy Corporation Common Stock,$52.04,0.28,0.541%,13279519687.00,United States,,561533,Utilities,Power Generation
LNZAW,LanzaTech Global Inc. Warrant,$0.4499,-0.0253,-5.324%,88205247.00,United States,2021,6903,Industrials,Major Chemicals
LOAN,Manhattan Bridge Capital Inc,$4.7221,-0.0379,-0.796%,54066085.00,United States,,9898,Real Estate,Real Estate Investment Trusts
LOCO,El Pollo Loco Holdings Inc. Common Stock,$8.56,0.01,0.117%,282079974.00,United States,2014,77619,Consumer Discretionary,Restaurants
LODE,Comstock Inc. Common Stock,$0.529,-0.021,-3.818%,61961889.00,United States,,348743,Finance,Real Estate
LOGI,Logitech International S.A. Ordinary Shares,$93.34,0.25,0.269%,14816577851.00,United States,1997,118999,Technology,Computer peripheral equipment
LOOP,Loop Industries Inc. Common Stock,$3.52,-0.11,-3.03%,167274578.00,Canada,,6582,Industrials,Major Chemicals
LOW,Lowe's Companies Inc. Common Stock,$212.47,0.20,0.094%,122194174122.00,United States,,833984,Consumer Discretionary,RETAIL: Building Materials
LPLA,LPL Financial Holdings Inc. Common Stock,$234.17,1.44,0.619%,17708064896.00,United States,2010,196957,Finance,Investment Bankers/Brokers/Service
LPSN,LivePerson Inc. Common Stock,$3.585,-0.025,-0.693%,289819294.00,United States,2000,519497,Technology,Computer Software: Prepackaged Software
LPTV,Loop Media Inc. Common Stock,$0.8164,-0.0517,-5.956%,57712319.00,United States,2022,17785,Industrials,Broadcasting
LPTX,Leap Therapeutics Inc. Common Stock,$4.275,-0.205,-4.576%,109292145.00,United States,,97103,Health Care,Biotechnology: Pharmaceutical Preparations
LRCX,Lam Research Corporation Common Stock,$736.65,-0.28,-0.038%,97084576800.00,United States,1984,322529,Technology,Industrial Machinery/Components
LRE,Lead Real Estate Co. Ltd American Depositary Shares,$5.5695,0.1189,2.181%,75978562.00,Japan,2023,126,,
LRFC,Logan Ridge Finance Corporation Common Stock,$23.00,-0.34,-1.457%,61546620.00,United States,2013,4319,Finance,Finance Companies
LRMR,Larimar Therapeutics Inc. Common Stock,$4.84,-0.04,-0.82%,212504571.00,United States,2014,34031,Health Care,Biotechnology: Pharmaceutical Preparations
LSAK,Lesaka Technologies Inc. Common Stock,$3.56,0.00,0.00%,222088898.00,South Africa,,2996,Technology,EDP Services
LSBK,Lake Shore Bancorp Inc. Common Stock,$12.18,0.00,0.00%,69313652.00,United States,2006,10,Finance,Savings Institutions
LTRX,Lantronix Inc. Common Stock,$5.90,0.04,0.683%,219865459.00,United States,2000,70062,Telecommunications,Computer Communications Equipment
LUCD,Lucid Diagnostics Inc. Common Stock,$1.393,0.023,1.679%,62221554.00,United States,2021,19018,Health Care,Biotechnology: Electromedical & Electrotherapeutic Apparatus
LULU,lululemon athletica inc. Common Stock,$497.995,-0.025,-0.005%,60294638054.00,Canada,2007,397507,Consumer Discretionary,Apparel
LUNA,Luna Innovations Incorporated Common Stock,$6.60,-0.05,-0.752%,224127031.00,United States,2006,57441,Health Care,Biotechnology: Commercial Physical & Biological Resarch
LUNR,Intuitive Machines Inc. Class A Common Stock,$2.29,0.05,2.232%,96307745.00,United States,2021,300835,Industrials,Industrial Machinery/Components
LUV,Southwest Airlines Company Common Stock,$27.80,0.49,1.794%,16572007564.00,United States,,2824665,Consumer Discretionary,Air Freight/Delivery Services
LUXH,LuxUrban Hotels Inc. Common Stock,$5.9099,0.3499,6.293%,217698199.00,United States,2022,95900,Finance,Real Estate
LVLU,Lulu's Fashion Lounge Holdings Inc. Common Stock,$1.90,-0.05,-2.564%,76899747.00,United States,2021,8386,Consumer Discretionary,Catalog/Specialty Distribution
LVO,LiveOne Inc. Common Stock,$1.30,0.05,4.00%,118527699.00,United States,,72074,Consumer Discretionary,Restaurants
LVROW,Lavoro Limited Warrant,$0.74,0.01,1.37%,86290163.00,Brazil,,1400,Finance,Blank Checks
LVS,Las Vegas Sands Corp. Common Stock,$50.125,-0.545,-1.076%,38320105059.00,United States,2004,1170168,Consumer Discretionary,Hotels/Resorts
